
==================================== ERRORS ====================================
___________________ ERROR collecting t/unit/app/test_app.py ____________________
ImportError while importing test module '/home/pedro_campelo/projects/cin/testesDeValidacaoDeSoftware/flaky-tests-experiments/celery/t/unit/app/test_app.py'.
Hint: make sure your test modules/packages have valid Python names.
Traceback:
/usr/lib/python3.12/importlib/__init__.py:90: in import_module
    return _bootstrap._gcd_import(name[level:], package, level)
           ^^^^^^^^^^^^^^^^^^^^^^^^^^^^^^^^^^^^^^^^^^^^^^^^^^^^
t/unit/app/test_app.py:19: in <module>
    from pydantic import BaseModel, ValidationInfo, model_validator
E   ModuleNotFoundError: No module named 'pydantic'
___________ ERROR collecting t/unit/backends/test_azureblockblob.py ____________
ImportError while importing test module '/home/pedro_campelo/projects/cin/testesDeValidacaoDeSoftware/flaky-tests-experiments/celery/t/unit/backends/test_azureblockblob.py'.
Hint: make sure your test modules/packages have valid Python names.
Traceback:
/usr/lib/python3.12/importlib/__init__.py:90: in import_module
    return _bootstrap._gcd_import(name[level:], package, level)
           ^^^^^^^^^^^^^^^^^^^^^^^^^^^^^^^^^^^^^^^^^^^^^^^^^^^^
t/unit/backends/test_azureblockblob.py:6: in <module>
    from celery.backends import azureblockblob
celery/backends/azureblockblob.py:2: in <module>
    from kombu.transport.azurestoragequeues import Transport as AzureStorageQueuesTransport
../../flaky-tests-comparative-study/.venv/lib/python3.12/site-packages/kombu/transport/azurestoragequeues.py:59: in <module>
    from azure.core.exceptions import ResourceExistsError
E   ModuleNotFoundError: No module named 'azure'
_________________ ERROR collecting t/unit/backends/test_gcs.py _________________
ImportError while importing test module '/home/pedro_campelo/projects/cin/testesDeValidacaoDeSoftware/flaky-tests-experiments/celery/t/unit/backends/test_gcs.py'.
Hint: make sure your test modules/packages have valid Python names.
Traceback:
/usr/lib/python3.12/importlib/__init__.py:90: in import_module
    return _bootstrap._gcd_import(name[level:], package, level)
           ^^^^^^^^^^^^^^^^^^^^^^^^^^^^^^^^^^^^^^^^^^^^^^^^^^^^
t/unit/backends/test_gcs.py:5: in <module>
    from google.cloud.exceptions import NotFound
E   ModuleNotFoundError: No module named 'google.cloud'
_______________ ERROR collecting t/unit/backends/test_mongodb.py _______________
ImportError while importing test module '/home/pedro_campelo/projects/cin/testesDeValidacaoDeSoftware/flaky-tests-experiments/celery/t/unit/backends/test_mongodb.py'.
Hint: make sure your test modules/packages have valid Python names.
Traceback:
/usr/lib/python3.12/importlib/__init__.py:90: in import_module
    return _bootstrap._gcd_import(name[level:], package, level)
           ^^^^^^^^^^^^^^^^^^^^^^^^^^^^^^^^^^^^^^^^^^^^^^^^^^^^
t/unit/backends/test_mongodb.py:5: in <module>
    import dns.version
E   ModuleNotFoundError: No module named 'dns'
________________ ERROR collecting t/unit/backends/test_redis.py ________________
t/unit/backends/test_redis.py:374: in <module>
    class MyCredentialProvider(CredentialProvider):
E   TypeError: NoneType takes no arguments
_________________ ERROR collecting t/unit/backends/test_s3.py __________________
ImportError while importing test module '/home/pedro_campelo/projects/cin/testesDeValidacaoDeSoftware/flaky-tests-experiments/celery/t/unit/backends/test_s3.py'.
Hint: make sure your test modules/packages have valid Python names.
Traceback:
/usr/lib/python3.12/importlib/__init__.py:90: in import_module
    return _bootstrap._gcd_import(name[level:], package, level)
           ^^^^^^^^^^^^^^^^^^^^^^^^^^^^^^^^^^^^^^^^^^^^^^^^^^^^
t/unit/backends/test_s3.py:3: in <module>
    import boto3
E   ModuleNotFoundError: No module named 'boto3'
_________________ ERROR collecting t/unit/tasks/test_canvas.py _________________
ImportError while importing test module '/home/pedro_campelo/projects/cin/testesDeValidacaoDeSoftware/flaky-tests-experiments/celery/t/unit/tasks/test_canvas.py'.
Hint: make sure your test modules/packages have valid Python names.
Traceback:
/usr/lib/python3.12/importlib/__init__.py:90: in import_module
    return _bootstrap._gcd_import(name[level:], package, level)
           ^^^^^^^^^^^^^^^^^^^^^^^^^^^^^^^^^^^^^^^^^^^^^^^^^^^^
t/unit/tasks/test_canvas.py:7: in <module>
    import pytest_subtests  # noqa
    ^^^^^^^^^^^^^^^^^^^^^^
E   ModuleNotFoundError: No module named 'pytest_subtests'
______________ ERROR collecting t/unit/utils/test_annotations.py _______________
ImportError while importing test module '/home/pedro_campelo/projects/cin/testesDeValidacaoDeSoftware/flaky-tests-experiments/celery/t/unit/utils/test_annotations.py'.
Hint: make sure your test modules/packages have valid Python names.
Traceback:
/usr/lib/python3.12/importlib/__init__.py:90: in import_module
    return _bootstrap._gcd_import(name[level:], package, level)
           ^^^^^^^^^^^^^^^^^^^^^^^^^^^^^^^^^^^^^^^^^^^^^^^^^^^^
t/unit/utils/test_annotations.py:6: in <module>
    from pydantic import BaseModel
E   ModuleNotFoundError: No module named 'pydantic'
_______________ ERROR collecting t/unit/utils/test_functional.py _______________
ImportError while importing test module '/home/pedro_campelo/projects/cin/testesDeValidacaoDeSoftware/flaky-tests-experiments/celery/t/unit/utils/test_functional.py'.
Hint: make sure your test modules/packages have valid Python names.
Traceback:
/usr/lib/python3.12/importlib/__init__.py:90: in import_module
    return _bootstrap._gcd_import(name[level:], package, level)
           ^^^^^^^^^^^^^^^^^^^^^^^^^^^^^^^^^^^^^^^^^^^^^^^^^^^^
t/unit/utils/test_functional.py:4: in <module>
    import pytest_subtests  # noqa
    ^^^^^^^^^^^^^^^^^^^^^^
E   ModuleNotFoundError: No module named 'pytest_subtests'
=============================== warnings summary ===============================
t/unit/app/test_backends.py:116
  /home/pedro_campelo/projects/cin/testesDeValidacaoDeSoftware/flaky-tests-experiments/celery/t/unit/app/test_backends.py:116: PytestUnknownMarkWarning: Unknown pytest.mark.celery - is this a typo?  You can register custom marks to avoid this warning - for details, see https://docs.pytest.org/en/stable/how-to/mark.html
    @pytest.mark.celery(

t/unit/backends/test_base.py:1433
  /home/pedro_campelo/projects/cin/testesDeValidacaoDeSoftware/flaky-tests-experiments/celery/t/unit/backends/test_base.py:1433: PytestUnknownMarkWarning: Unknown pytest.mark.celery - is this a typo?  You can register custom marks to avoid this warning - for details, see https://docs.pytest.org/en/stable/how-to/mark.html
    @pytest.mark.celery(result_backend='disabled')

t/unit/backends/test_base.py:1438
  /home/pedro_campelo/projects/cin/testesDeValidacaoDeSoftware/flaky-tests-experiments/celery/t/unit/backends/test_base.py:1438: PytestUnknownMarkWarning: Unknown pytest.mark.celery - is this a typo?  You can register custom marks to avoid this warning - for details, see https://docs.pytest.org/en/stable/how-to/mark.html
    @pytest.mark.celery(result_backend='disabled')

t/unit/backends/test_rpc.py:60
  /home/pedro_campelo/projects/cin/testesDeValidacaoDeSoftware/flaky-tests-experiments/celery/t/unit/backends/test_rpc.py:60: PytestUnknownMarkWarning: Unknown pytest.mark.celery - is this a typo?  You can register custom marks to avoid this warning - for details, see https://docs.pytest.org/en/stable/how-to/mark.html
    @pytest.mark.celery(result_backend='rpc')

t/unit/backends/test_rpc.py:65
  /home/pedro_campelo/projects/cin/testesDeValidacaoDeSoftware/flaky-tests-experiments/celery/t/unit/backends/test_rpc.py:65: PytestUnknownMarkWarning: Unknown pytest.mark.celery - is this a typo?  You can register custom marks to avoid this warning - for details, see https://docs.pytest.org/en/stable/how-to/mark.html
    @pytest.mark.celery(result_backend='rpc')

-- Docs: https://docs.pytest.org/en/stable/how-to/capture-warnings.html
=========================== short test summary info ============================
ERROR t/unit/app/test_app.py
ERROR t/unit/backends/test_azureblockblob.py
ERROR t/unit/backends/test_gcs.py
ERROR t/unit/backends/test_mongodb.py
ERROR t/unit/backends/test_redis.py - TypeError: NoneType takes no arguments
ERROR t/unit/backends/test_s3.py
ERROR t/unit/tasks/test_canvas.py
ERROR t/unit/utils/test_annotations.py
ERROR t/unit/utils/test_functional.py
!!!!!!!!!!!!!!!!!!! Interrupted: 9 errors during collection !!!!!!!!!!!!!!!!!!!!
10 skipped, 5 warnings, 9 errors in 4.65s
